3815,J39,8,J398,Otras Enfermedades Especificadas de las Vias Respiratorias Superiores
3816,J39,9,J399,"Enfermedad de las Vias Respiratorias Superiores, no Especificada"
3817,J40,X,J40X,"Bronquitis, no Especificada como Aguda o Cronica"
3818,J41,0,J410,Bronquitis Cronica Simple
3819,J41,1,J411,Bronquitis Cronica Mucopurulenta
3820,J41,8,J418,Bronquitis Cronica Mixta Simple y Mucopurulenta
3821,J42,X,J42X,Bronquitis Cronica no Especificada
3822,J43,0,J430,Sindrome de Macleod
3823,J43,1,J431,Enfisema Panlobular
3824,J43,2,J432,Enfisema Centrolobular
3825,J43,8,J438,Otros Tipos de Enfisema
3826,J43,9,J439,"Enfisema, no Especificado"
3827,J44,0,J440,Enfermedad Pulmonar Obstructiva Cronica con Infeccion Aguda de las Vias Respiratorias In
3828,J44,1,J441,"Enfermedad Pulmonar Obstructiva Cronica con Exacerbacion Aguda, no Especificada"
3829,J44,8,J448,Otras Enfermedades Pulmonares Obstructivas Cronicas Especificadas
3830,J44,9,J449,"Enfermedad Pulmonar Obstructiva Cronica, no Especificada"
3831,J45,0,J450,Asma Predominantemente Alergica. Bronquitis Alergica
3832,J45,1,J451,Asma no Alergica.
3833,J45,8,J458,Asma Mixta
3834,J45,9,J459,"Asma no Especificado. Asma de Aparicion Tardia. Bronquitis Asmatica/Sob Sibiliancia, Hip"
3835,J45,91,J4591,SOB / Sibilancia Hiperactividad Bronquial
3836,J46,X,J46X,Estado Asmatico.  Asma Aguda Severa.
3837,J47,X,J47X,Bronquiectasia
3838,J60,X,J60X,Neumoconiosis de los Mineros del Carbon
3839,J61,X,J61X,Neumoconiosis debida al Asbesto y a otras Fibras Minerales
3840,J62,0,J620,Neumoconiosis debida a Polvo de Talco
3841,J62,8,J628,Neumoconiosis debida a otros Polvos que Contienen Silice
3842,J63,0,J630,Aluminosis (del Pulmon)
3843,J63,1,J631,Fibrosis (del Pulmon) debida a Bauxita
3844,J63,2,J632,Beriliosis
3845,J63,3,J633,Fibrosis (del Pulmon) debida a Grafito
3846,J63,4,J634,Siderosis
3847,J63,5,J635,Estanosis
3848,J63,8,J638,Neumoconiosis debida a otros Polvos Inorganicos Especificados
3849,J64,X,J64X,"Neumoconiosis, no Especificada"
3850,J65,X,J65X,Neumoconiosis Asociada con Tuberculosis
3851,J66,0,J660,Bisinosis
3852,J66,1,J661,Enfermedad de los Trabajadores del Lino
3853,J66,2,J662,Canabinosis
3854,J66,8,J668,Enfermedad de las Vias Aereas debida a otros Polvos Organicos Especificos
3855,J67,0,J670,Pulmon del Granjero
3856,J67,1,J671,Bagazosis
3857,J67,2,J672,Pulmon del Ornitofilo
3858,J67,3,J673,Suberosis
3859,J67,4,J674,Pulmon del Manipulador de Malta
3860,J67,5,J675,Pulmon del Manipulador de Hongos
3861,J67,6,J676,Pulmon del descortezador del Arce
3862,J67,7,J677,Neumonitis de la Ventilacion debida al Acondicionador y Humidificador del Aire
3863,J67,8,J678,Neumonitis debidas a Hipersensibilidad a otros Polvos Organicos
3864,J67,9,J679,Neumonitis debida a Hipersensibilidad a Polvo Organico no Especificado
3865,J68,0,J680,"Bronquitis y Neumonitis debidas a Inhalacion de Gases, Humos, Vapores y Sustancias Quimi"
3866,J68,1,J681,"Edema Pulmonar Agudo debido a Inhalacion de Gases, Humos, Vapores y Sustancias Quimicas"
3867,J68,2,J682,"Inflamacion Respiratoria Superior debida a Inhalacion de Gases, Humos, Vapores y Sustanc"
3868,J68,3,J683,"Otras Afecciones Respiratorias Agudas y Subagudas debidas a Inhalacion de Gases, Humos,"
3869,J68,4,J684,"Afecciones Respiratorias Cronicas debidas a Inhalacion de Gases, Humos, Vapores y Sustan"
3870,J68,8,J688,"Otras Afecciones Respiratorias debidas a Inhalacion de Gases, Humos, Vapores y Sustancia"
3871,J68,9,J689,"Afeccion Respiratoria no Especificada, debida a Inhalacion de Gases, Humos, Vapores y Su"
3872,J69,0,J690,Neumonitis debida a Aspiracion de Alimento o Vomito
3873,J69,1,J691,Neumonitis debida a Aspiracion de Aceites y Esencias
3874,J69,8,J698,Neumonitis debida a Aspiracion de otros Solidos y Liquidos
3875,J70,0,J700,Manifestaciones Pulmonares Agudas debidas a Radiacion
3876,J70,1,J701,Manifestaciones Pulmonares Cronicas y otras Manifestaciones debidas a Radiacion
3877,J70,2,J702,Trastornos Pulmonares Intersticiales Agudos Inducidos por drogas
3878,J70,3,J703,Trastornos Pulmonares Intersticiales Cronicos Inducidos por drogas
3879,J70,4,J704,Trastornos Pulmonares Intersticiales no Especificados Inducidos por drogas
3880,J70,8,J708,Afecciones Respiratorias debidas a otros Agentes Externos Especificados
3881,J70,9,J709,Afecciones Respiratorias debidas a Agentes Externos no Especificados
3882,J80,X,J80X,Sindrome de dificultad Respiratoria del Adulto
3883,J81,X,J81X,Edema Pulmonar
3884,J82,X,J82X,"Eosinofilia Pulmonar, no Clasificada en otra parte"
3885,J84,0,J840,Afecciones Alveolares y Alveoloparietales
3886,J84,1,J841,Otras Enfermedades Pulmonares Intersticiales con Fibrosis
3887,J84,8,J848,Otras Enfermedades Pulmonares Intersticiales Especificadas
3888,J84,9,J849,"Enfermedad Pulmonar Intersticial, no Especificada"
3889,J85,0,J850,Gangrena y Necrosis del Pulmon
3890,J85,1,J851,Absceso del Pulmon con Neumonia
3891,J85,2,J852,Absceso del Pulmon sin Neumonia
3892,J85,3,J853,Absceso del Mediastino
3893,J86,0,J860,Piotorax con Fistula
3894,J86,9,J869,Piotorax sin Fistula
3895,J90,X,J90X,Pleuresia no Tuberculosa
3896,J91,X,J91X,Derrame Pleural en Afecciones Clasificadas en otra parte
3897,J92,0,J920,Paquipleuritis con Asbestosis
3898,J92,9,J929,Paquipleuritis sin Asbestosis
3899,J93,0,J930,Neumotorax Espontaneo a Presion
3900,J93,1,J931,Otros Tipos de Neumotorax Espontaneo
3901,J93,8,J938,Otros Neumotorax
3902,J93,9,J939,"Neumotorax, no Especificado"
3903,J94,0,J940,Quilotorax
3904,J94,1,J941,Fibrotorax
3905,J94,2,J942,Hemotorax
3906,J94,8,J948,Otras Afecciones Especificadas de la Pleura
3907,J94,9,J949,"Afeccion Pleural, no Especificada"
3908,J95,0,J950,Funcionamiento defectuoso de la Traqueostomia
3909,J95,1,J951,Insuficiencia Pulmonar Aguda Consecutiva a Cirugia Toracica
3910,J95,2,J952,Insuficiencia Pulmonar Aguda Consecutiva a Cirugia Extratoracica
3911,J95,3,J953,Insuficiencia Pulmonar Cronica Consecutiva a Cirugia
3912,J95,4,J954,Sindrome de Mendelson
3913,J95,5,J955,Estenosis Subglotica Consecutiva a Procedimientos
3914,J95,8,J958,Otros Trastornos Respiratorios Consecutivos a Procedimientos
3915,J95,9,J959,"Trastorno no Especificado del Sistema Respiratorio, Consecutivo a Procedimientos"
3916,J96,0,J960,Insuficiencia Respiratoria Aguda
3917,J96,1,J961,Insuficiencia Respiratoria Cronica
3918,J96,9,J969,"Insuficiencia Respiratoria, no Especificada"
3919,J98,0,J980,"Enfermedades de la Traquea y de los Bronquios, no Clasificadas en otra parte"
3920,J98,1,J981,Colapso Pulmonar
3921,J98,2,J982,Enfisema Intersticial
3922,J98,3,J983,Enfisema Compensatorio
3923,J98,4,J984,Otros Trastornos del Pulmon
3924,J98,5,J985,"Enfermedades del Mediastino, no Clasificadas en otra parte"
3925,J98,6,J986,Trastornos del diafragma
3926,J98,8,J988,Otros Trastornos Respiratorios Especificados
3927,J98,9,J989,"Trastorno Respiratorio, no Especificado"
3928,J99,0,J990,Enfermedad Pulmonar Reumatoide (M05.1+)
3929,J99,1,J991,Trastornos Respiratorios en otros Trastornos difusos del Tejido Conjuntivo
3930,J99,8,J998,Trastornos Respiratorios en otras Enfermedades Clasificadas en otra parte
3931,K00,0,K000,Anodoncia
3932,K00,1,K001,Dientes Supernumerarios
3933,K00,2,K002,Anomalias del Tamano y de la Forma del diente
3934,K00,3,K003,Dientes Moteados
3935,K00,4,K004,Alteraciones en la Formacion dentaria
3936,K00,5,K005,"Altera.Hereditarias de Estructura dentaria,No Clasificadas en otra parte"
3937,K00,6,K006,Alteraciones en la Erupcion dentaria
3938,K00,7,K007,Sindrome de la Erupcion dentaria
3939,K00,8,K008,Otros Trastornos del desarrollo de los dientes
3940,K00,9,K009,"Trastono del desarrollo de los dientes, no Especificado"
3941,K01,0,K010,Dientes Incluidos
3942,K01,1,K011,Dientes Impactados
3943,K02,0,K020,Caries Limitada al Esmalte
3944,K02,1,K021,Caries de la dentina
3945,K02,2,K022,Caries del Cemento
3946,K02,3,K023,Caries dentaria detenida
3947,K02,4,K024,Odontoclasia
3948,K02,8,K028,Otras Caries dentales
3949,K02,9,K029,"Caries dental, no Especificada"
3950,K03,0,K030,Atricion Excesiva de los dientes
3951,K03,1,K031,Abrasion de los dientes
3952,K03,2,K032,Erosion de los dientes
3953,K03,3,K033,Reabsorcion Patologica de los dientes
3954,K03,4,K034,Hipercementosis
3955,K03,5,K035,Anquilosis dental
3956,K03,6,K036,Depositos (Acreciones) en los dientes
3957,K03,7,K037,Cambios Posteruptivos del Color de los Tejidos dentales duros
3958,K03,8,K038,Otras Enfermedades Especificadas de los Tejidos duros de los dientes
3959,K03,9,K039,Enfermedad no Especificada de los Tejidos dentales duros
3960,K04,0,K040,Pulpitis
3961,K04,1,K041,Necrosis de la Pulpa
3962,K04,2,K042,Degeneracion de la Pulpa
3963,K04,3,K043,Formacion Anormal de Tejido duro en la Pulpa
3964,K04,4,K044,Periodontitis Apical Aguda Originada en la Pulpa
3965,K04,5,K045,Periodontitis Apical Cronica
3966,K04,6,K046,Absceso Periapical con Fistula
3967,K04,7,K047,Absceso Periapical sin Fistula
3968,K04,8,K048,Quiste Radicular
3969,K04,9,K049,Otras Enfermedades y las no Especificadas de la Pulpa y del Tejido Periapical
3970,K05,0,K050,Gingivitis Aguda
3971,K05,1,K051,Gingivitis Cronica
3972,K05,2,K052,Periodontitis Aguda
3973,K05,3,K053,Periodontitis Cronica
3974,K05,4,K054,Periodontosis
3975,K05,5,K055,Otras Enfermedades Periodontales
3976,K05,6,K056,"Enfermedad del Periodonto, no Especificada"
3977,K06,0,K060,Retraccion Gingival
3978,K06,1,K061,Hiperplasia Gingival
3979,K06,2,K062,Lesiones de la Encia y de la Zona Edentula Asociadas con Traumatismo
3980,K06,8,K068,Otros Trastornos Especificados de la Encia y de la Zona Edentula
3981,K06,9,K069,Trastorno no Especificado de la Encia y de la Zona Edentula
3982,K07,0,K070,Anomalias Evidentes del Tamano de los Maxilares
3983,K07,1,K071,Anomalias de la Relacion Maxilobasilar
3984,K07,2,K072,Anomalias de la Relacion Entre los Arcos dentarios
3985,K07,3,K073,Anomalias de la Posicion del diente
3986,K07,4,K074,Maloclusion de Tipo no Especificado
3987,K07,5,K075,Anomalias dentofaciales Funcionales
3988,K07,6,K076,Trastornos de la Articulacion Temporomaxilar
3989,K07,8,K078,Otras Anomalias dentofaciales
3990,K07,9,K079,"Anomalia dentofacial, no Especificada"
3991,K08,0,K080,Exfoliacion de los dientes debida a Causas Sistemicas
3992,K08,1,K081,"Perdida de dientes debida a Accidentes, Extraccion o Enfermedad Periodontal Local"
3993,K08,2,K082,Atrofia del Reborde Alveolar desdentado
3994,K08,3,K083,Raiz dental Retenida
3995,K08,8,K088,Otras Afecciones Especificadas de los dientes y de Estructura de Sosten
3996,K08,9,K089,"Trastorno de los dientes y de sus Estructuras de Sosten, no Especificado"
3997,K09,0,K090,Quistes Originados por el desarrollo de los dientes
3998,K09,1,K091,Quistes de las Fisuras (No Odontogenicos)
3999,K09,2,K092,Otros Quistes de los Maxilares
4000,K09,8,K098,"Otros Quistes de la Region Bucal, no Clasificados en otra parte"
4001,K09,9,K099,"Quiste de la Region Bucal, sin otra Especificacion"
4002,K10,0,K100,Trastornos del desarrollo de los Maxilares
4003,K10,1,K101,Granuloma Central de Celulas Gigantes
4004,K10,2,K102,Afecciones Inflamatorias de los Maxilares
4005,K10,3,K103,Alveolitis del Maxilar
4006,K10,8,K108,Otras Enfermedades Especificadas de los Maxilares
4007,K10,9,K109,"Enfermedad de los Maxilares, no Especificada"
4008,K11,0,K110,Atrofia de Glandula Salival
4009,K11,1,K111,Hipertrofia de Glandula Salival
4010,K11,2,K112,Sialadenitis
4011,K11,3,K113,Absceso de Glandula Salival
4012,K11,4,K114,Fistula de Glandula Salival
4013,K11,5,K115,Sialolitiasis
4014,K11,6,K116,Mucocele de Glandula Salival
4015,K11,7,K117,Alteraciones de la Secrecion Salival
4016,K11,8,K118,Otras Enfermedades de las Glandulas Salivales
4017,K11,9,K119,"Enfermedad de Glandula Salival, no Especificada"
4018,K12,0,K120,Estomatitis Aftosa Recurrente
4019,K12,1,K121,Otras Formas de Estomatitis
4020,K12,2,K122,Celulitis y Abceso de Boca
4021,K12,3,K123,Mucositis oral (ulcerativa)
4022,K13,0,K130,Enfermedades de los Labios
4023,K13,1,K131,Mordedura del Labio y de la Mejilla
4024,K13,2,K132,"Leucoplasia y otras Alteraciones del Epitelio Bucal, Incluyendo la Lengua"
4025,K13,3,K133,Leucoplasia Pilosa
4026,K13,4,K134,Granuloma y Lesiones Semejantes de la Mucosa Bucal
4027,K13,5,K135,Fibrosis de la Submucosa Bucal
4028,K13,6,K136,Hiperplasia Irritativa de la Mucosa Bucal
4029,K13,7,K137,Otras Lesiones y las no Especificadas de la Mucosa Bucal
4030,K14,0,K140,Glositis ( Absceso / Ulcera de la Lengua)
4031,K14,1,K141,Lengua Geografica
4032,K14,2,K142,Glositis Romboidea Mediana
4033,K14,3,K143,Hipertrofia de las Papilas Linguales
4034,K14,4,K144,Atrofia de las Papilas Linguales
4035,K14,5,K145,Lengua Plegada
4036,K14,6,K146,Glosodinia
4037,K14,8,K148,Otras Enfermedades de la Lengua
4038,K14,9,K149,"Enfermedad de la Lengua, no Especificada"
4039,K20,X,K20X,Esofagitis
4040,K21,0,K210,Enfermedad del Reflujo Gastroesofagico con Esofagitis
4041,K21,9,K219,Enfermedad del Reflujo Gastroesofagico sin Esofagitis
4042,K22,0,K220,Acalasia del Cardias
4043,K22,1,K221,Ulcera del Esofago
4044,K22,2,K222,Obstruccion del Esofago
4045,K22,3,K223,Perforacion del Esofago
4046,K22,4,K224,Disquinesia del Esofago
4047,K22,5,K225,"Diverticulo del Esofago, Adquirido"
4048,K22,6,K226,Sindrome de Laceracion y Hemorragia Gastroesofagicas
4049,K22,8,K228,Otras Enfermedades Especificadas del Esofago
4050,K22,9,K229,"Enfermedad del Esofago, no Especificada"
4051,K22,7,K227,Esófago de Barrett
4052,K23,0,K230,Esofagitis Tuberculosa (A18.8+)
4053,K23,1,K231,Megaesofago en la Enfermedad de Chagas (B57.3+)
4054,K23,8,K238,Trastornos del Esofago en otras Enfermedades Clasificadas en otra parte
4055,K25,0,K250,"Ulcera Gastrica, Aguda con Hemorragia"
4056,K25,1,K251,"Ulcera Gastrica, Aguda con Perforacion"
4057,K25,2,K252,"Ulcera Gastrica, Aguda con Hemorragia y Perforacion"
4058,K25,3,K253,"Ulcera Gastrica, Aguda sin Hemorragia ni Perforacion"
4059,K25,4,K254,"Ulcera Gastrica, Cronica o no Especificada, con Hemorragia"
4060,K25,5,K255,"Ulcera Gastrica, Cronica o no Especificada, con Perforacion"
4061,K25,6,K256,"Ulcera Gastrica, Cronica o no Especificada, con Hemorragia y Perforacion"
4062,K25,7,K257,"Ulcera Gastrica, Cronica sin Hemorragia ni Perforacion"
4063,K25,9,K259,"Ulcera Gastrica, no Especificada como Aguda ni Cronica, sin Hemorragia ni Perforacion"
4064,K26,0,K260,"Ulcera Duodenal, Aguda con Hemorragia"
4065,K26,1,K261,"Ulcera Duodenal, Aguda con Perforacion"
4066,K26,2,K262,"Ulcera Duodenal, Aguda con Hemorragia y Perforacion"
4067,K26,3,K263,"Ulcera Duodenal, Aguda sin Hemorragia ni Perforacion"
4068,K26,4,K264,"Ulcera Duodenal, Cronica o no Especificada, con Hemorragia"
4069,K26,5,K265,"Ulcera Duodenal, Cronica o no Especificada, con Perforacion"
4070,K26,6,K266,"Ulcera Duodenal, Cronica o no Especificada, con Hemorragia y Perforacion"
4071,K26,7,K267,"Ulcera Duodenal, Cronica sin Hemorragia ni Perforacion"
4072,K26,9,K269,"Ulcera Duodenal, no Especificada como Aguda ni Cronica, sin Hemorragia ni Perforacion"
4073,K27,0,K270,"Ulcera Peptica, de Sitio no Especificado, Aguda con Hemorragia"
4074,K27,1,K271,"Ulcera Peptica, de Sitio no Especificado, Aguda con Perforacion"
4075,K27,2,K272,"Ulcera Peptica, de Sitio no Especificado, Aguda con Hemorragia y Perforacion"
4076,K27,3,K273,"Ulcera Peptica, de Sitio no Especificado, Aguda sin Hemorragia ni Perforacion"
4077,K27,4,K274,"Ulcera Peptica, de Sitio no Especificado, Cronica o no Especificada, Conhemorragia"
4078,K27,5,K275,"Ulcera Peptica, de Sitio no Especificado, Cronica o no Especificada, Conperforacion"
4079,K27,6,K276,"Ulcera Peptica, de Sitio no Especificado, Cronica o no Especificada, con Hemorragia y Pe"
4080,K27,7,K277,"Ulcera Peptica, de Sitio no Especificado, Cronica sin Hemorragia ni Perforacion"
4081,K27,9,K279,"Ulcera Peptica, no Especificada como Aguda ni Cronica, sin Hemorragia ni Perforacion"
4082,K28,0,K280,"Ulcera Gastroyeyunal, Aguda con Hemorragia"
4083,K28,1,K281,"Ulcera Gastroyeyunal, Aguda con Perforacion"
4084,K28,2,K282,"Ulcera Gastroyeyunal, Aguda con Hemorragia y Perforacion"
4085,K28,3,K283,"Ulcera Gastroyeyunal, Aguda sin Hemorragia ni Perforacion"
4086,K28,4,K284,"Ulcera Gastroyeyunal, Cronica o no Especificada, con Hemorragia"
4087,K28,5,K285,"Ulcera Gastroyeyunal, Cronica o no Especificada, con Perforacion"
4088,K28,6,K286,"Ulcera Gastroyeyunal, Cronica o no Especificada, con Hemorragia y Perforacion"
4089,K28,7,K287,"Ulcera Gastroyeyunal, Cronica sin Hemorragia ni Perforacion"
4090,K28,9,K289,"Ulcera Gastroyeyunal, no Especificada como Aguda ni Cronica, sin Hemorragia ni Perforaci"
4091,K29,0,K290,Gastritis Aguda Hemorragica
4092,K29,1,K291,Otras Gastritis Agudas
4093,K29,2,K292,Gastritis Alcoholica
4094,K29,3,K293,Gastritis Cronica Superficial
4095,K29,4,K294,Gastritis Cronica Atrofica
4096,K29,5,K295,"Gastritis Cronica, no Especificada"
4097,K29,6,K296,Otras Gastritis
4098,K29,7,K297,"Gastritis, no Especificada"
4099,K29,8,K298,Duodenitis
4100,K29,9,K299,"Gastroduodenitis, no Especificada"
4101,K30,X,K30X,Dispepsia
4102,K31,0,K310,Dilatacion Aguda del Estomago
4103,K31,1,K311,Estenosis Pilorica Hipertrofica del Adulto
4104,K31,2,K312,Estrechez o Estenosis del Estomago en Reloj de Arena
4105,K31,3,K313,"Espasmo del Piloro, no Clasificado en otra parte"
4106,K31,4,K314,Diverticulo Gastrico
4107,K31,5,K315,Obstruccion del duodeno
4108,K31,6,K316,Fistula del Estomago y del duodeno
4109,K31,8,K318,Otras Enfermedades Especificadas del Estomago y del duodeno
4110,K31,9,K319,"Enfermedad del Estomago y del duodeno, no Especificada"
4111,K31,7,K317,Polipo del Estomago y del duodeno
4112,K35,0,K350,Apendicitis Aguda con Peritonitis Generalizada
4113,K35,1,K351,Apendicitis Aguda con Absceso Peritoneal
4114,K35,9,K359,"Apendicitis Aguda, no Especificada"
4115,K35,2,K352,Apendicitis aguda con peritonitis generalizada
4116,K35,3,K353,Apendicitis aguda con peritonitis localizada
4117,K35,8,K358,Otras apendicitis agudas y las no especificadas
4118,K36,X,K36X,Otros Tipos de Apendicitis
4119,K37,X,K37X,"Apendicitis, no Especificada"
4120,K38,0,K380,Hiperplasia del Apendice
4121,K38,1,K381,Concreciones Apendiculares
4122,K38,2,K382,Diverticulo del Apendice
4123,K38,3,K383,Fistula del Apendice
4124,K38,8,K388,Otras Enfermedades Especificadas del Apendice
4125,K38,9,K389,"Enfermedad del Apendice, no Especificada"
4126,K40,0,K400,"Hernia Inguinal Bilateral con Obstruccion, sin Gangrena"
4127,K40,1,K401,"Hernia Inguinal Bilateral, con Gangrena"
4128,K40,2,K402,"Hernia Inguinal Bilateral, sin Obstruccion ni Gangrena"
4129,K40,3,K403,"Hernia Inguinal Unilateral o no Especificada, con Obstruccion, sin Gangrena"
4130,K40,4,K404,"Hernia Inguinal Unilateral o no Especificada, con Gangrena"
4131,K40,9,K409,"Hernia Inguinal Unilateral o no Especificada, sin Obstruccion ni Gangrena"
4132,K41,0,K410,"Hernia Femoral Bilateral, con Obstruccion, sin Gangrena"
4133,K41,1,K411,"Hernia Femoral Bilateral, con Gangrena"
4134,K41,2,K412,"Hernia Femoral Bilateral, sin Obstruccion ni Gangrena"
4135,K41,3,K413,"Hernia Femoral Unilateral o no Especificada, con Obstruccion, sin Gangrena"
4136,K41,4,K414,"Hernia Femoral Unilateral o no Especificada, con Gangrena"
4137,K41,9,K419,"Hernia Femoral Unilateral o no Especificada, sin Obstruccion ni Gangrena"
4138,K42,0,K420,"Hernia Umbilical con Obstruccion, sin Gangrena"
4139,K42,1,K421,Hernia Umbilical con Gangrena
4140,K42,9,K429,Hernia Umbilical sin Obstruccion ni Gangrena
4141,K43,0,K430,"Hernia Ventral con Obstruccion, sin Gangrena"
4142,K43,1,K431,Hernia Ventral con Gangrena
4143,K43,9,K439,Hernia Ventral sin Obstruccion ni Gangrena
4144,K44,0,K440,"Hernia diafragmatica con Obstruccion, sin Gangrena"
4145,K44,1,K441,Hernia diafragmatica con Gangrena
4146,K44,9,K449,Hernia diafragmatica sin Obstruccion ni Gangrena
4147,K45,0,K450,"Otras Hernias de la Cavidad Abdominal Especificadas, con Obstruccion, sin Gangrena"
4148,K45,1,K451,"Otras Hernias de la Cavidad Abdominal Especificadas, con Gangrena"
4149,K45,8,K458,"Otras Hernias de la Cavidad Abdominal Especificadas, sin Obstruccion ni Gangrena"
4150,K46,0,K460,"Hernia Abdominal no Especificada, con Obstruccion, sin Gangrena"
4151,K46,1,K461,"Hernia Abdominal no Especificada, con Gangrena"
4152,K46,9,K469,"Hernia Abdominal no Especificada, sin Obstruccion ni Gangrena"
4153,K50,0,K500,Enfermedad de Crohn del Intestino delgado
4154,K50,1,K501,Enfermedad de Crohn del Intestino Grueso
4155,K50,8,K508,Otros Tipos de Enfermedad de Crohn
4156,K50,9,K509,"Enfermedad de Crohn, no Especificada"
4157,K51,0,K510,Pancolitis (Cronica) Ulcerativa
4158,K51,1,K511,Ileocolitis (Cronica) Ulcerativa
4159,K51,2,K512,Proctitis (Cronica) Ulcerativa
4160,K51,3,K513,Rectosigmoiditis (Cronica) Ulcerativa
4161,K51,4,K514,Poliposis inflamatoria
4162,K51,5,K515,Colitis del lado izquierdo
4163,K51,8,K518,Otras Colitis Ulcerativas
4164,K51,9,K519,"Colitis Ulcerativa, sin otra Especificacion"
4165,K52,0,K520,Colitis y Gastroenteritis debidas a Radiacion
4166,K52,1,K521,Colitis y Gastroenteritis Toxicas
4167,K52,2,K522,Colitis y Gastroenteritis Alergicas y dieteticas
4168,K52,8,K528,Otras Colitis y Gastroenteritis no Infecciosas Especificadas
4169,K52,9,K529,"Colitis y Gastroenteritis no Infecciosas, no Especificadas"
4170,K52,3,K523,Colitis indeterminada
4171,K55,0,K550,Trastorno Vascular Agudo de los Intestinos
4172,K55,1,K551,Trastorno Vascular Cronico del Intestino
4173,K55,2,K552,Angiodisplasia del Colon
4174,K55,8,K558,Otros Trastornos Vasculares del Intestino
4175,K55,9,K559,"Trastorno Vascular del Intestino, no Especificado"
4176,K56,0,K560,Ileo Paralitico
4177,K56,1,K561,Invaginacion
4178,K56,2,K562,Volvulo
4179,K56,3,K563,Ileo por Calculo Biliar
4180,K56,4,K564,Otras Obstrucciones del Intestino
4181,K56,5,K565,Adherencias [Bridas] Intestinales con Obstruccion
4182,K56,6,K566,Otras Obstrucciones Intestinales y las no Especificadas
4183,K56,7,K567,"Ileo, no Especificado"
4184,K57,0,K570,Enfermedad Diverticular del Intestino delgado con Perforacion y Absceso
4185,K57,1,K571,Enfermedad Diverticular del Intestino delgado sin Perforacion ni Absceso
4186,K57,2,K572,Enfermedad Diverticular del Intestino Grueso con Perforacion y Absceso
4187,K57,3,K573,Enfermedad Diverticular del Intestino Grueso sin Perforacion ni Absceso
4188,K57,4,K574,Enfermedad Diverticular de Ambos Intestinos con Perforacion y Absceso
4189,K57,5,K575,"Enfermedad Diverticular de Ambos Intestinos, sin Perforacion ni Absceso"
4190,K57,8,K578,"Enfermedad Diverticular del Intestino, parte no Especificada, con Perforacion y Absceso"
4191,K57,9,K579,"Enfermedad Diverticular del Intestino, parte no Especificada, sin Perforacion ni Absceso"
4192,K58,0,K580,Sindrome del Colon Irritable con diarrea
4193,K58,9,K589,Sindrome del Colon Irritable sin diarrea
4194,K59,0,K590,Constipacion
4195,K59,1,K591,Diarrea Funcional
4196,K59,2,K592,"Intestino Neurogenico, no Clasificado en otra parte"
4197,K59,3,K593,"Megacolon, no Clasificado en otra parte"
4198,K59,4,K594,Espasmo Anal
4199,K59,8,K598,Otros Trastornos Funcionales Especificados del Intestino
4200,K59,9,K599,"Trastorno Funcional Intestinal, no Especificado"
4201,K60,0,K600,Fisura Anal Aguda
4202,K60,1,K601,Fisura Anal Cronica
4203,K60,2,K602,"Fisura Anal, no Especificada"
4204,K60,3,K603,Fistula Anal
4205,K60,4,K604,Fistula Rectal
4206,K60,5,K605,Fistula Anorrectal
4207,K61,0,K610,Absceso Anal
4208,K61,1,K611,Absceso Rectal
4209,K61,2,K612,Absceso Anorrectal
4210,K61,3,K613,Absceso Isquiorrectal
4211,K61,4,K614,Absceso Intraesfinteriano
4212,K62,0,K620,Polipo Anal
4213,K62,1,K621,Polipo Rectal
4214,K62,2,K622,Prolapso Anal
4215,K62,3,K623,Prolapso Rectal
4216,K62,4,K624,Estenosis del Ano y del Recto
4217,K62,5,K625,Hemorragia del Ano y del Recto
4218,K62,6,K626,Ulcera del Ano y del Recto
4219,K62,7,K627,Proctitis por Radiacion
4220,K62,8,K628,Proctitis
4221,K62,9,K629,"Enfermedad del Ano y del Recto, no Especificada"
4222,K63,0,K630,Absceso del Intestino
4223,K63,1,K631,Perforacion del Intestino (No Traumatica)
4224,K63,2,K632,Fistula del Intestino
4225,K63,3,K633,Ulcera del Intestino
4226,K63,4,K634,Enteroptosis
4227,K63,8,K638,Otras Enfermedades Especificadas del Intestino
4228,K63,9,K639,"Enfermedad del Intestino, no Especificada"
4229,K63,5,K635,Polipo del Colon
4230,K65,0,K650,Peritonitis Aguda
4231,K65,8,K658,Otras Peritonitis
4232,K65,9,K659,"Peritonitis, no Especificada"
4233,K66,0,K660,Adherencias Peritoneales
4234,K66,1,K661,Hemoperitoneo
4235,K66,8,K668,Otros Trastornos Especificados del Peritoneo
4236,K66,9,K669,"Trastorno del Peritoneo, no Especificado"
4237,K67,0,K670,Peritonitis por Clamidias (A74.8+)
4238,K67,1,K671,Peritonitis Gonococica (A54.8+)
4239,K67,2,K672,Peritonitis Sifilitica (A52.7+)
4240,K67,3,K673,Peritonitis Tuberculosa (A18.3+)
4241,K67,8,K678,Otros Trastornos del Peritoneo en Enfermedades Infecciosas Clasificadas en otra parte
4242,K70,0,K700,Higado Alcoholico Adiposo
4243,K70,1,K701,Hepatitis Alcoholica
4244,K70,2,K702,"Fibrosis y Esclerosis del Higado, Alcoholica"
4245,K70,3,K703,Cirrosis Hepatica Alcoholica
4246,K70,4,K704,Insuficiencia Hepatica Alcoholica
4247,K70,9,K709,"Enfermedad Hepatica Alcoholica, no Especificada"
4248,K71,0,K710,"Enfermedad Toxica del Higado, con Colestasis"
4249,K71,1,K711,Enfermedad Toxica del Higado con Necrosis Hepatica
4250,K71,2,K712,Enfermedad Toxica del Higado con Hepatitis Aguda
4251,K71,3,K713,Enfermedad Toxica del Higado con Hepatitis Cronica Persistente
4252,K71,4,K714,Enfermedad Toxica del Higado con Hepatitis Cronica Lobular
4253,K71,5,K715,Enfermedad Toxica del Higado con Hepatitis Cronica Activa
4254,K71,6,K716,Enfermedad Toxica del Higado con Hepatitis no Clasificada en otra parte
4255,K71,7,K717,Enfermedad Toxica del Higado con Cirrosis y Fibrosis del Higado
4256,K71,8,K718,Enfermedad Toxica del Higado con otros Trastornos Hepaticos
4257,K71,9,K719,"Enfermedad Toxica del Higado, no Especificada"
4258,K72,0,K720,Insuficiencia Hepatica Aguda o Subaguda
4259,K72,1,K721,Insuficiencia Hepatica Cronica
4260,K72,9,K729,"Insuficiencia Hepatica, no Especificada"
