7629,S30,8,S308,"Otros Traumatismos Superficiales del Abdomen, de la Region Lumbosacra y de la Pelvis"
7630,S30,9,S309,"Traumatismo Superficial del Abdomen, de la Region Lumbosacra y de la Pelvis, parte no Es"
7631,S31,0,S310,Herida de la Region Lumbosacra y de la Pelvis
7632,S31,1,S311,Herida de la Pared Abdominal
7633,S31,2,S312,Herida del Pene
7634,S31,3,S313,Herida del Escroto y de los Testiculos
7635,S31,4,S314,Herida de la Vagina y de la Vulva
7636,S31,5,S315,Herida de otros Organos Genitales Externos y de los no Especificados
7637,S31,7,S317,"Heridas Multiples del Abdomen, de la Region Lumbosacra y de la Pelvis"
7638,S31,8,S318,Heridas de otras partes y de las no Especificadas del Abdomen
7639,S32,0,S320,Fractura de Vertebra Lumbar
7640,S32,1,S321,Fractura del Sacro
7641,S32,2,S322,Fractura del Coccix
7642,S32,3,S323,Fractura del Hueso Iliaco
7643,S32,4,S324,Fractura del Acetabulo
7644,S32,5,S325,Fractura del Pubis
7645,S32,7,S327,Fracturas Multiples de la Columna Lumbar y de la Pelvis
7646,S32,8,S328,Fractura de otras partes y de las no Especificadas de la Columna Lumbar y de la Pelvis
7647,S33,0,S330,Ruptura Traumatica de disco Intervertebral Lumbar
7648,S33,1,S331,Luxacion de Vertebra Lumbar
7649,S33,2,S332,Luxacion de Articulacion Sacrococcigea y Sacroiliaca
7650,S33,3,S333,Luxacion de otras partes y de las no Especificadas de la Columna Lumbar y de la Pelvis
7651,S33,4,S334,Ruptura Traumatica de la Sinfisis del Pubis
7652,S33,5,S335,Esguinces y Torceduras de la Columna Lumbar
7653,S33,6,S336,Esguinces y Torceduras de la Articulacion Sacroiliaca
7654,S33,7,S337,Esguinces y Torceduras de otras partes y de las no Especificadas de la Columna Lumbar y
7655,S34,0,S340,Concusion y Edema de la Medula Espinal Lumbar
7656,S34,1,S341,Otro Traumatismo de la Medula Espinal Lumbar
7657,S34,2,S342,Traumatismo de Raiz Nerviosa de la Columna Lumbar y Sacra
7658,S34,3,S343,Traumatismo de la Cola de Caballo
7659,S34,4,S344,Traumatismo del Plexo Lumbosacro
7660,S34,5,S345,"Traumatismo de Nervios (s) Simpatico (s) Lumbar(Es), Sacro (s) y Pelvico (s)"
7661,S34,6,S346,"Traumatismo de Nervio (s) Periferico (s) del Abdomen, de la Region Lumbosacra y de la Pelv"
7662,S34,8,S348,"Traumatismo de otros Nervios a nivel del Abdomen, de la Region Lumbosacra y de la Pelvis"
7663,S35,0,S350,Traumatismo de la Aorta Abdominal
7664,S35,1,S351,Traumatismo de la Vena Cava Inferior
7665,S35,2,S352,Traumatismo de Arterias Celiacas y Mesentericas
7666,S35,3,S353,Traumatismo de Venas Porta y Esplenica
7667,S35,4,S354,Traumatismo de Vasos Sanguineos Renales
7668,S35,5,S355,Traumatismo de Vasos Sanguineos Iliacos
7669,S35,7,S357,"Traumatismo de Multiples Vasos Sanguineos a nivel del Abdomen, de la Region Lumbosacra y"
7670,S35,8,S358,"Traumatismo de otros Vasos Sanguineos a nivel del Abdomen, de la Region Lumbosacra y de"
7671,S35,9,S359,"Traumatismo de Vasos Sanguineos no Especificados a nivel del Abdomen, de la Region Lumbo"
7672,S36,0,S360,Traumatismo del Bazo
7673,S36,1,S361,Traumatismo del Higado y de la Vesicula Biliar
7674,S36,2,S362,Traumatismo del Pancreas
7675,S36,3,S363,Traumatismo del Estomago
7676,S36,4,S364,Traumatismo del Intestino delgado
7677,S36,5,S365,Traumatismo del Colon
7678,S36,6,S366,Traumatismo del Recto
7679,S36,7,S367,Traumatismo de Multiples Organos Intraabdominales
7680,S36,8,S368,Traumatismo de otros Organos Intraabdominales
7681,S36,9,S369,Traumatismo de Organo Intraabdominal no Especificado
7682,S37,0,S370,Traumatismo del Rinon
7683,S37,1,S371,Traumatismo del Ureter
7684,S37,2,S372,Traumatismo de la Vejiga
7685,S37,3,S373,Traumatismo de la Uretra
7686,S37,4,S374,Traumatismo del Ovario
7687,S37,5,S375,Traumatismo de la Trompa de Falopio
7688,S37,6,S376,Traumatismo del Utero
7689,S37,7,S377,Traumatismo de Multiples Organos Pelvicos
7690,S37,8,S378,Traumatismo de otros Organos Pelvicos
7691,S37,9,S379,Traumatismo de Organo Pelvico no Especificado
7692,S38,0,S380,Traumatismo por Aplastamiento de Organos Genitales Externos
7693,S38,1,S381,"Traumatismo por Aplastamiento de otras partes y de las no Especificadas del Abdomen, de"
7694,S38,2,S382,Amputacion Traumatica de Organos Genitales Externos
7695,S38,3,S383,"Amputacion Traumatica de otras partes y de las no Especificadas del Abdomen, Region Lumb"
7696,S39,0,S390,"Traumatismo de Tendon y de Musculos del Abdomen, de la Region Lumbosacra y de la Pelvis"
7697,S39,6,S396,Traumatismo de Organo (s) Intraabdominal(es) con Organo (s) Pelvico (s)
7698,S39,7,S397,"Otros Traumatismos Multiples del Abdomen, de la Region Lumbosacra y de la Pelvis"
7699,S39,8,S398,"Otros Traumatismos Especificados del Abdomen, de la Region Lumbosacra y de la Pelvis"
7700,S39,9,S399,"Traumatismo no Especificado del Abdomen, de la Region Lumbosacra y de la Pelvis"
7701,S40,0,S400,Contusion del Hombro y del Brazo
7702,S40,7,S407,Traumatismos Superficiales Multiples del Hombro y del Brazo
7703,S40,8,S408,Otros Traumatismos Superficiales del Hombro y del Brazo
7704,S40,9,S409,Traumatismo Superficial no Especificado del Hombro y del Brazo
7705,S41,0,S410,Herida del Hombro
7706,S41,1,S411,Herida del Brazo
7707,S41,7,S417,Heridas Multiples del Hombro y del Brazo
7708,S41,8,S418,Herida de otras partes y de las no Especificadas del Hombro y del Brazo
7709,S42,0,S420,Fractura de la Clavicula
7710,S42,1,S421,Fractura del Omoplato
7711,S42,2,S422,Fractura de la Epifisis Superior del Humero
7712,S42,3,S423,Fractura de la diafisis del Humero
7713,S42,4,S424,Fractura de la Epifisis Inferior del Humero
7714,S42,7,S427,"Fracturas Multiples de la Clavicula, del Omoplato y del Humero"
7715,S42,8,S428,Fractura de otras partes del Hombro y del Brazo
7716,S42,9,S429,"Fractura del Hombro y del Brazo, parte no Especificada"
7717,S43,0,S430,Luxacion de la Articulacion del Hombro
7718,S43,1,S431,Luxacion de la Articulacion Acromioclavicular
7719,S43,2,S432,Luxacion de la Articulacion Esternoclavicular
7720,S43,3,S433,Luxacion de otras partes de la Cintura Escapular y de las no Especificadas
7721,S43,4,S434,Esguinces y Torceduras de la Articulacion del Hombro
7722,S43,5,S435,Esguinces y Torceduras de la Articulacion Acromioclavicular
7723,S43,6,S436,Esguinces y Torceduras de la Articulacion Esternoclavicular
7724,S43,7,S437,Esguinces y Torceduras de otras partes y de las no Especificadas de la Cintura Escapular
7725,S44,0,S440,Traumatismo del Nervio Cubital a nivel del Brazo
7726,S44,1,S441,Traumatismo del Nervio Mediano a nivel del Brazo
7727,S44,2,S442,Traumatismo del Nervio Radial a nivel del Brazo
7728,S44,3,S443,Traumatismo del Nervio Axilar
7729,S44,4,S444,Traumatismo del Nervio Musculocutaneo
7730,S44,5,S445,Traumatismo del Nervio Sensitivo Cutaneo a nivel del Hombro y del Brazo
7731,S44,7,S447,Traumatismo de Multiples Nervios a nivel del Hombro y del Brazo
7732,S44,8,S448,Traumatismo de otros Nervios a nivel del Hombro y del Brazo
7733,S44,9,S449,Traumatismo de Nervio no Especificado a nivel del Hombro y del Brazo
7734,S45,0,S450,Traumatismo de la Arteria Axilar
7735,S45,1,S451,Traumatismo de la Arteria Braquial
7736,S45,2,S452,Traumatismo de la Vena Axilar o Braquial
7737,S45,3,S453,Traumatismo de Vena Superficial a nivel del Hombro y del Brazo
7738,S45,7,S457,Traumatismo de Multiples Vasos Sanguineos a nivel del Hombro y del Brazo
7739,S45,8,S458,Traumatismo de otros Vasos Sanguineos a nivel del Hombro y del Brazo
7740,S45,9,S459,Traumatismo de Vaso Sanguineo no Especificado a nivel del Hombro y del Brazo
7741,S46,0,S460,Traumatismo del Tendon del Manguito Rotatorio del Hombro
7742,S46,1,S461,Traumatismo del Tendon y Musculo de la Cabeza Larga del Biceps
7743,S46,2,S462,Traumatismo del Tendon y Musculo de otras partes del Biceps
7744,S46,3,S463,Traumatismo del Tendon y Musculo del Triceps
7745,S46,7,S467,Traumatismo de Multiples Tendones y Musculos a nivel del Hombro y del Brazo
7746,S46,8,S468,Traumatismo de otros Tendones y Musculos a nivel del Hombro y del Brazo
7747,S46,9,S469,"Traumatismo de Tendon y Musculo no Especificado, a nivel del Hombro y del Brazo"
7748,S47,X,S47X,Traumatismo por Aplastamiento del Hombro y del Brazo
7749,S48,0,S480,Amputacion Traumatica en la Articulacion del Hombro
7750,S48,1,S481,Amputacion Traumatica a nivel Entre el Hombro y el Codo
7751,S48,9,S489,"Amputacion Traumatica del Hombro y del Brazo, nivel no Especificado"
7752,S49,7,S497,Traumatismos Multiples del Hombro y del Brazo
7753,S49,8,S498,Otros Traumatismos Especificados del Hombro y del Brazo
7754,S49,9,S499,Traumatismos no Especificados del Hombro y del Brazo
7755,S50,0,S500,Contusion del Codo
7756,S50,1,S501,Contusion de otras partes del Antebrazo y de las no Especificadas
7757,S50,7,S507,Traumatismos Superficiales Multiples del Antebrazo
7758,S50,8,S508,Otros Traumatismos Superficiales del Antebrazo
7759,S50,9,S509,"Traumatismo Superficial del Antebrazo, no Especificado"
7760,S51,0,S510,Herida del Codo
7761,S51,7,S517,Heridas Multiples del Antebrazo
7762,S51,8,S518,Herida de otras partes del Antebrazo
7763,S51,9,S519,"Herida del Antebrazo, parte no Especificada"
7764,S52,0,S520,Fractura de la Epifisis Superior del Cubito
7765,S52,1,S521,Fractura de la Epifisis Superior del Radio
7766,S52,2,S522,Fractura de la diafisis del Cubito
7767,S52,3,S523,Fractura de la diafisis del Radio
7768,S52,4,S524,Fractura de la diafisis del Cubito y del Radio
7769,S52,5,S525,Fractura de la Epifisis Inferior del Radio
7770,S52,6,S526,Fractura de la Epifisis Inferior del Cubito y del Radio
7771,S52,7,S527,Fracturas Multiples del Antebrazo
7772,S52,8,S528,Fractura de otras partes del Antebrazo
7773,S52,9,S529,"Fractura del Antebrazo, parte no Especificada"
7774,S53,0,S530,Luxacion de la Cabeza del Radio
7775,S53,1,S531,"Luxacion del Codo, no Especificada"
7776,S53,2,S532,Ruptura Traumatica del Ligamento Lateral del Radio
7777,S53,3,S533,Ruptura Traumatica del Ligamento Lateral del Cubito
7778,S53,4,S534,Esguinces y Torceduras del Codo
7779,S54,0,S540,Traumatismo del Nervio Cubital a nivel del Antebrazo
7780,S54,1,S541,Traumatismo del Nervio Mediano a nivel del Antebrazo
7781,S54,2,S542,Traumatismo del Nervio Radial a nivel del Antebrazo
7782,S54,3,S543,Traumatismo del Nervio Sensorial Cutaneo a nivel del Antebrazo
7783,S54,7,S547,Traumatismo de Multiples Nervios a nivel del Antebrazo
7784,S54,8,S548,Traumatismo de otros Nervios a nivel del Antebrazo
7785,S54,9,S549,Traumatismo de Nervio no Especificado a nivel del Antebrazo
7786,S55,0,S550,Traumatismo de la Arteria Cubital a nivel del Antebrazo
7787,S55,1,S551,Traumatismo de la Arteria Radial a nivel del Antebrazo
7788,S55,2,S552,Traumatismo de Vena a nivel del Antebrazo
7789,S55,7,S557,Traumatismo de Multiples Vasos Sanguineos a nivel del Antebrazo
7790,S55,8,S558,Traumatismo de otros Vasos Sanguineos a nivel del Antebrazo
7791,S55,9,S559,Traumatismo de Vaso Sanguineo no Especificado a nivel del Antebrazo
7792,S56,0,S560,Traumatismo del Tendon y Musculo Flexor del Pulgar a nivel del Antebrazo
7793,S56,1,S561,Traumatismo del Tendon y Musculo Flexor de Otro (s) dedo (s) a nivel del Antebrazo
7794,S56,2,S562,Traumatismo de Otro Tendon y Musculo Flexor a nivel del Antebrazo
7795,S56,3,S563,Traumatismo de Tendones y Musculos Abductores y Extensores del Pulgar a nivel del Antebr
7796,S56,4,S564,Traumatismo del Tendon y Musculo Extensor de Otro (s) dedo (s) a nivel del Antebrazo
7797,S56,5,S565,Traumatismo de Otro Tendon y Musculo Extensor a nivel del Antebrazo
7798,S56,7,S567,Traumatismo de Multiples Tendones y Musculos a nivel del Antebrazo
7799,S56,8,S568,"Traumatismo de otros Tendones y Musculos y de los no Especificados, a nivel del Antebraz"
7800,S57,0,S570,Traumatismo por Aplastamiento del Codo
7801,S57,8,S578,Traumatismo por Aplastamiento de otras partes del Antebrazo
7802,S57,9,S579,"Traumatismo por Aplastamiento del Antebrazo, parte no Especificada"
7803,S58,0,S580,Amputacion Traumatica a nivel del Codo
7804,S58,1,S581,Amputacion Traumatica nivel Entre el Codo y la Muneca
7805,S58,9,S589,"Amputacion Traumatica del Antebrazo, nivel no Especificado"
7806,S59,7,S597,Traumatismos Multiples del Antebrazo
7807,S59,8,S598,Otros Traumatismos Especificados del Antebrazo
7808,S59,9,S599,Traumatismo no Especificado del Antebrazo
7809,S60,0,S600,"Contusion de dedo (s) de la Mano, sin dano de La (s) Una (s)"
7810,S60,1,S601,Contusion de dedo (s) de la Mano con dano de La (s) Una (s)
7811,S60,2,S602,Contusion de otras partes de la Muneca y de la Mano
7812,S60,7,S607,Traumatismos Superficiales Multiples de la Muneca y de la Mano
7813,S60,8,S608,Otros Traumatismos Superficiales de la Muneca y de la Mano
7814,S60,9,S609,"Traumatismo Superficial de la Muneca y de la Mano, no Especificado"
7815,S61,0,S610,"Herida de dedo (s) de la Mano, sin dano de La (s) Una (s)"
7816,S61,1,S611,"Herida de dedo (s) de la Mano, con dano de La (s) Una (s)"
7817,S61,7,S617,Heridas Multiples de la Muneca y de la Mano
7818,S61,8,S618,Herida de otras partes de la Muneca y de la Mano
7819,S61,9,S619,"Herida de la Muneca y de la Mano, parte no Especificada"
7820,S62,0,S620,Fractura del Hueso Escafoides [Navicular] de la Mano
7821,S62,1,S621,Fractura de Otro (s) Hueso (s) del Carpo
7822,S62,2,S622,Fractura del Primer Metacarpiano
7823,S62,3,S623,Fractura de otros Huesos Metacarpianos
7824,S62,4,S624,Fracturas Multiples de Huesos Metacarpianos
7825,S62,5,S625,Fractura del Pulgar
7826,S62,6,S626,Fractura de Otro dedo de la Mano
7827,S62,7,S627,Fracturas Multiples de los dedos de la Mano
7828,S62,8,S628,Fractura de otras partes y de las no Especificadas de la Muneca y de la Mano
7829,S63,0,S630,Luxacion de la Muneca
7830,S63,1,S631,Luxacion de dedos de la Mano
7831,S63,2,S632,Luxaciones Multiples de dedos de la Mano
7832,S63,3,S633,Ruptura Traumatica de Ligamentos de la Muneca y del Carpo
7833,S63,4,S634,Ruptura Traumatica de Ligamentos del dedo de la Mano en la (s)Articulacion(es) Metacarpof
7834,S63,5,S635,Esguince y Torcedura de la Muneca
7835,S63,6,S636,Esguinces y Torceduras de dedo (s) de la Mano
7836,S63,7,S637,Esguinces y Torceduras de otras partes y de las no Especificadas de la Muneca y de la Ma
7837,S64,0,S640,Traumatismo del Nervio Cubital a nivel de la Muneca y de la Mano
7838,S64,1,S641,Traumatismo del Nervio Mediano a nivel de la Muneca y de la Mano
7839,S64,2,S642,Traumatismo del Nervio Radial a nivel de la Muneca y de la Mano
7840,S64,3,S643,Traumatismo del Nervio digital del Pulgar
7841,S64,4,S644,Traumatismo del Nervio digital de Otro dedo
7842,S64,7,S647,Traumatismo de Multiples Nervios a nivel de la Muneca y de la Mano
7843,S64,8,S648,Traumatismo de otros Nervios a nivel de la Muneca y de la Mano
7844,S64,9,S649,Traumatismo de Nervio no Especificado a nivel de la Muneca y de la Mano
7845,S65,0,S650,Traumatismo de la Arteria Cubital a nivel de la Muneca y de la Mano
7846,S65,1,S651,Traumatismo de la Arteria Radial a nivel de la Muneca y de la Mano
7847,S65,2,S652,Traumatismo del Arco Palmar Superficial
7848,S65,3,S653,Traumatismo del Arco Palmar Profundo
7849,S65,4,S654,Traumatismo de Vaso (s) Sanguineo (s) del Pulgar
7850,S65,5,S655,Traumatismo de Vaso (s) Sanguineo (s) de Otro dedo
7851,S65,7,S657,Traumatismo de Multiples Vasos Sanguineos a nivel de la Muneca y de la Mano
7852,S65,8,S658,Traumatismo de otros Vasos Sanguineos a nivel de la Muneca y de la Mano
7853,S65,9,S659,"Traumatismo de Vaso Sanguineo no Especificado, a nivel de la Muneca y de la Mano"
7854,S66,0,S660,Traumatismo del Tendon y Musculo Flexor Largo del Pulgar a nivel de la Muneca y de la Ma
7855,S66,1,S661,Traumatismo del Tendon y Musculo Flexor de Otro dedo a nivel de la Muneca y de la Mano
7856,S66,2,S662,Traumatismo del Tendon y Musculo Extensor del Pulgar a nivel de la Muneca y de la Mano
7857,S66,3,S663,Traumatismo del Tendon y Musculo Extensor de Otro (s) dedo (s) a nivel de la Muneca y de L
7858,S66,4,S664,Traumatismo del Musculo y Tendon Intrinseco del Pulgar a nivel de la Muneca y de la Mano
7859,S66,5,S665,Traumatismo del Musculo y Tendon Intrinseco de Otro (s) dedo (s) a nivel de la Muneca y de
7860,S66,6,S666,Traumatismo de Multiples Tendones y Musculos Flexores a nivel de la Muneca y de la Mano
7861,S66,7,S667,Traumatismo de Multiples Tendones y Musculos Extensores a nivel de la Muneca y de la Man
7862,S66,8,S668,Traumatismo de otros Tendones y Musculos a nivel de la Muneca y de la Mano
7863,S66,9,S669,"Traumatismo de Tendon y Musculo no Especificado, a nivel de la Muneca y de la Mano"
7864,S67,0,S670,Traumatismo por Aplastamiento del Pulgar y Otro (s) dedo (s)
7865,S67,8,S678,Traumatismo por Aplastamiento de otras partes y de las no Especificadas de la Muneca y d
7866,S68,0,S680,Amputacion Traumatica del Pulgar (Completa) (Parcial)
7867,S68,1,S681,Amputacion Traumatica de Otro dedo Unico (Completa) (Parcial)
7868,S68,2,S682,Amputacion Traumatica de dos o Mas dedos Solamente (Completa) (Parcial)
7869,S68,3,S683,Amputacion Traumatica Combinada (de parte) de dedo (s) con otras partes de la Muneca y de
7870,S68,4,S684,Amputacion Traumatica de la Mano a nivel de la Muneca
7871,S68,8,S688,Amputacion Traumatica de otras partes de la Muneca y de la Mano
7872,S68,9,S689,"Amputacion Traumatica de la Muneca y de la Mano, nivel no Especificado"
7873,S69,7,S697,Traumatismos Multiples de la Muneca y de la Mano
7874,S69,8,S698,Otros Traumatismos Especificados de la Muneca y de la Mano
7875,S69,9,S699,Traumatismo no Especificado de la Muneca y de la Mano
7876,S70,0,S700,Contusion de la Cadera
7877,S70,1,S701,Contusion del Muslo
7878,S70,7,S707,Traumatismos Superficiales Multiples de la Cadera y del Muslo
7879,S70,8,S708,Otros Traumatismos Superficiales de la Cadera y del Muslo
7880,S70,9,S709,"Traumatismo Superficial de la Cadera y del Muslo, no Especificado"
7881,S71,0,S710,Herida de la Cadera
7882,S71,1,S711,Herida del Muslo
7883,S71,7,S717,Heridas Multiples de la Cadera y del Muslo
7884,S71,8,S718,Herida de otras partes y de las no Especificadas de la Cintura Pelvica
7885,S72,0,S720,Fractura del Cuello de Femur
7886,S72,1,S721,Fractura Pertrocanteriana
7887,S72,2,S722,Fractura Subtrocanteriana
7888,S72,3,S723,Fractura de la diafisis del Femur
7889,S72,4,S724,Fractura de la Epifisis Inferior del Femur
7890,S72,7,S727,Fracturas Multiples del Femur
7891,S72,8,S728,Fracturas de otras partes del Femur
7892,S72,9,S729,"Fractura del Femur, parte no Especificada"
7893,S73,0,S730,Luxacion de la Cadera
7894,S73,1,S731,Esguinces y Torceduras de la Cadera
7895,S74,0,S740,Traumatismo del Nervio Ciatico a nivel de la Cadera y del Muslo
7896,S74,1,S741,Traumatismo del Nervio Femorocutaneo a nivel de la Cadera y del Muslo
7897,S74,2,S742,Traumatismo del Nervio Sensorial Cutaneo a nivel de la Cadera y del Muslo
7898,S74,7,S747,Traumatismo de Nervios Multiples a nivel de la Cadera y del Muslo
7899,S74,8,S748,Traumatismo de otros Nervios a nivel de la Cadera y del Muslo
7900,S74,9,S749,Traumatismo de Nervio no Especificado a nivel de la Cadera y del Muslo
7901,S75,0,S750,Traumatismo de la Arteria Femoral
7902,S75,1,S751,Traumatismo de la Vena Femoral a nivel de la Cadera y del Muslo
7903,S75,2,S752,Traumatismo de la Gran Vena Safena a nivel de la Cadera y del Muslo
7904,S75,7,S757,Traumatismo de Multiples Vasos Sanguineos a nivel de la Cadera y del Muslo
7905,S75,8,S758,Traumatismo de otros Vasos Sanguineos a nivel de la Cadera y del Muslo
7906,S75,9,S759,Traumatismo de Vaso Sanguineo no Especificado a nivel de la Cadera y del Muslo
7907,S76,0,S760,Traumatismo del Tendon y Musculo de la Cadera
7908,S76,1,S761,Traumatismo del Tendon y Musculo Cuadriceps
7909,S76,2,S762,Traumatismo del Tendon y Musculo Aductor Mayor del Muslo
7910,S76,3,S763,Traumatismo de Tendon y Musculo del Grupo Muscular Posterior a nivel del Muslo
7911,S76,4,S764,Traumatismo de otros Tendones y Musculos y los no Especificados a nivel del Muslo
7912,S76,7,S767,Traumatismo de Multiples Tendones y Musculos a nivel de la Cadera y del Muslo
7913,S77,0,S770,Traumatismo por Aplastamiento de la Cadera
7914,S77,1,S771,Traumatismo por Aplastamiento del Muslo
7915,S77,2,S772,Traumatismo por Aplastamiento de la Cadera con el Muslo
7916,S78,0,S780,Amputacion Traumatica de la Articulacion de la Cadera
7917,S78,1,S781,Amputacion Traumatica en Algun nivel Entre la Cadera y la Rodilla
7918,S78,9,S789,"Amputacion Traumatica de Cadera y Muslo, nivel no Especificado"
7919,S79,7,S797,Traumatismos Multiples de la Cadera y del Muslo
7920,S79,8,S798,Otros Traumatismos Especificados de la Cadera y del Muslo
7921,S79,9,S799,Traumatismo no Especificado de la Cadera y del Muslo
7922,S80,0,S800,Contusion de la Rodilla
7923,S80,1,S801,Contusion de otras partes y las no Especificadas de la Pierna
7924,S80,7,S807,Traumatismos Superficiales Multiples de la Pierna
7925,S80,8,S808,Otros Traumatismos Superficiales de la Pierna
7926,S80,9,S809,"Traumatismo Superficial de la Pierna, no Especificado"
7927,S81,0,S810,Herida de la Rodilla
7928,S81,7,S817,Heridas Multiples de la Pierna
7929,S81,8,S818,Herida de otras partes de la Pierna
7930,S81,9,S819,"Herida de la Pierna, parte no Especificada"
7931,S82,0,S820,Fractura de la Rotula
7932,S82,1,S821,Fractura de la Epifisis Superior de la Tibia
7933,S82,2,S822,Fractura de la diafisis de la Tibia
7934,S82,3,S823,Fractura de la Epifisis Inferior de la Tibia
7935,S82,4,S824,Fractura del Perone Solamente
7936,S82,5,S825,Fractura del Maleolo Interno
7937,S82,6,S826,Fractura del Maleolo Externo
7938,S82,7,S827,Fracturas Multiples de la Pierna
7939,S82,8,S828,Fractura de otras partes de la Pierna
7940,S82,9,S829,"Fractura de la Pierna, parte no Especificada"
7941,S83,0,S830,Luxacion de la Rotula
7942,S83,1,S831,Luxacion de la Rodilla
7943,S83,2,S832,"Desgarro de Meniscos, Presente"
7944,S83,3,S833,"Desgarro del Cartilago Articular de la Rodilla, Presente"
7945,S83,4,S834,Esguinces y Torceduras que Comprometen los Ligamentos Laterales (Externo) (Interno) de L
7946,S83,5,S835,Esguinces y Torceduras que Comprometen el Ligamento Cruzado (Anterior) (Posterior) de la
7947,S83,6,S836,Esguinces y Torceduras de otras partes y las no Especificadas de la Rodilla
7948,S83,7,S837,Traumatismo de Estructuras Multiples de la Rodilla
7949,S84,0,S840,Traumatismo del Nervio Tibial a nivel de la Pierna
7950,S84,1,S841,Traumatismo del Nervio Peroneo a nivel de la Pierna
7951,S84,2,S842,Traumatismo del Nervio Sensorial Cutaneo a nivel de la Pierna
7952,S84,7,S847,Traumatismo de Nervios Multiples a nivel de la Pierna
7953,S84,8,S848,Traumatismo de otros Nervios a nivel de la Pierna
7954,S84,9,S849,Traumatismo de Nervio no Especificado a nivel de la Pierna
7955,S85,0,S850,Traumatismo de la Arteria Poplitea
7956,S85,1,S851,Traumatismo de la Arteria Tibial (Anterior) (Posterior)
7957,S85,2,S852,Traumatismo de la Arteria Peronea
7958,S85,3,S853,Traumatismo de la Gran Vena Safena a nivel de la Pierna
7959,S85,4,S854,Traumatismo de la Vena Safena Externa a nivel de la Pierna
7960,S85,5,S855,Traumatismo de la Vena Poplitea
7961,S85,7,S857,Traumatismo de Vasos Sanguineos Multiples a nivel de la Pierna
7962,S85,8,S858,Traumatismo de otros Vasos Sanguineos a nivel de la Pierna
7963,S85,9,S859,Traumatismo de Vaso Sanguineo no Especificado a nivel de la Pierna
7964,S86,0,S860,Traumatismo del Tendon de Aquiles
7965,S86,1,S861,Traumatismo de Otro (s) Tendon (s) y Musculo (s) del Grupo Muscular Posterior a nivel de L
7966,S86,2,S862,Traumatismo de Tendon(Es) y Musculo (s) del Grupo Muscular Anterior a nivel de la Pierna
7967,S86,3,S863,Traumatismo de Tendon(Es) y Musculo (s) del Grupo Muscular Peroneo a nivel de la Pierna
7968,S86,7,S867,Traumatismo de Multiples Tendones y Musculos a nivel de la Pierna
7969,S86,8,S868,Traumatismo de otros Tendones y Musculos a nivel de la Pierna
7970,S86,9,S869,Traumatismo de Tendon y Musculo no Especificado a nivel de la Pierna
7971,S87,0,S870,Traumatismo por Aplastamiento de la Rodilla
7972,S87,8,S878,Traumatismo por Aplastamiento de otras partes y de las no Especificadas de la Pierna
7973,S88,0,S880,Amputacion Traumatica a nivel de la Rodilla
7974,S88,1,S881,Amputacion Traumatica en Algun nivel Entre la Rodilla y el Tobillo
7975,S88,9,S889,"Amputacion Traumatica de la Pierna, nivel no Especificado"
7976,S89,7,S897,Traumatismos Multiples de la Pierna
7977,S89,8,S898,"Otros Traumatismos de la Pierna, Especificados"
7978,S89,9,S899,"Traumatismo de la Pierna, no Especificado"
7979,S90,0,S900,Contusion del Tobillo
7980,S90,1,S901,Contusion de dedo (s) del Pie sin dano de La (s) Una (s)
7981,S90,2,S902,Contusion de dedo (s) del Pie con dano de La (s) Una (s)
7982,S90,3,S903,Contusion de otras partes y de las no Especificadas del Pie
7983,S90,7,S907,Traumatismos Superficiales Multiples del Pie y del Tobillo
7984,S90,8,S908,Otros Traumatismos Superficiales del Pie y del Tobillo
7985,S90,9,S909,"Traumatismo Superficial del Pie y del Tobillo, no Especificado"
7986,S91,0,S910,Herida del Tobillo
7987,S91,1,S911,Herida de dedo (s) del Pie sin dano de La (s) Una (s)
7988,S91,2,S912,Herida de dedo (s) del Pie con dano de La (s) Una (s)
7989,S91,3,S913,Herida de otras partes del Pie
7990,S91,7,S917,Heridas Multiples del Tobillo y del Pie
7991,S92,0,S920,Fractura del Calcaneo
7992,S92,1,S921,Fractura del Astragalo
7993,S92,2,S922,Fractura de Otro (s) Hueso (s) del Tarso
7994,S92,3,S923,Fractura de Hueso del Metatarso
7995,S92,4,S924,Fractura de los Huesos del dedo Gordo del Pie
7996,S92,5,S925,Fractura de los Huesos de Otro (s) dedo (s) del Pie
7997,S92,7,S927,Fracturas Multiples del Pie
7998,S92,9,S929,"Fractura del Pie, no Especificada"
7999,S93,0,S930,Luxacion de la Articulacion del Tobillo
8000,S93,1,S931,Luxacion de dedo (s) del Pie
8001,S93,2,S932,Ruptura de Ligamentos a nivel del Tobillo y del Pie
8002,S93,3,S933,Luxacion de otros Sitios y los no Especificados del Pie
8003,S93,4,S934,Esguinces y Torceduras del Tobillo
8004,S93,5,S935,Esguinces y Torceduras de dedo (s) del Pie
8005,S93,6,S936,Esguinces y Torceduras de otros Sitios y de los no Especificados del Pie
8006,S94,0,S940,Traumatismo del Nervio Plantar Externo
8007,S94,1,S941,Traumatismo del Nervio Plantar Interno
